{"name":"iPhone 13 Pro Max","identifier":["iPhone14,3"],"soc":"A15","cpid":"0x8110","arch":"arm64e","type":"iPhone","board":["D64AP"],"bdid":"0x0E","model":["A2484","A2641","A2643","A2644","A2645"],"released":["2021-09-24","2022-03-18"],"discontinued":"2022-09-07","colors":[{"name":"Alpine Green","hex":"546554","released":"2022-03-18","discontinued":"2022-09-07","key":"Alpine Green"},{"name":"Gold","hex":"F6E4C7","released":"2021-09-24","discontinued":"2022-09-07","key":"Gold"},{"name":"Graphite","hex":"4C4C4A","released":"2021-09-24","discontinued":"2022-09-07","key":"Graphite"},{"name":"Sierra Blue","hex":"93A9C0","released":"2021-09-24","discontinued":"2022-09-07","key":"Sierra Blue"},{"name":"Silver","hex":"F1F1E7","released":"2021-09-24","discontinued":"2022-09-07","key":"Silver"}],"info":[{"type":"SoC","SoC":"A15","Architecture":"arm64e (64-bit)","Manufacturing_Process":"5nm"},{"type":"Cores","CPU_Core_Count":6,"Performance_Cores":"2 @ 3.23 GHz","Efficiency_Cores":"4 @ 1.82 GHz","GPU_Core_Count":5,"Neural_Engine_Core_Count":16},{"type":"Memory","Storage":["128GB","256GB","512GB","1TB"],"RAM":"6GB LPDDR4X"},{"type":"Power","Battery_Capacity":"4,352mAh","Battery_Life":"28 hours","Charger":"20W Lightning"},{"type":"Connectivity","Ports":"1x Lightning","Cellular":["5G (sub-6 GHz and mmWave) with 4x4 MIMO","Gigabit LTE with 4x4 MIMO and LAA"],"Wi-Fi":"Wi‑Fi 6 (802.11ax) with 2x2 MIMO","Bluetooth":"5.0","Ultra-wideband":true},{"type":"Sensors","Front_Camera":["12MP sensor","ƒ/2.2 aperture"],"Telephoto_Camera":["12MP sensor","ƒ/2.8 aperture","3x optical zoom in","Optical image stabilization"],"Wide_Camera":["12MP sensor","ƒ/1.5 aperture","Optical image stabilization"],"Ultrawide_Camera":["12MP sensor","ƒ/1.8 aperture","120° field of view","2x optical zoom out","Optical image stabilization"],"TrueDepth_Camera":["12MP LiDAR sensor","ƒ/2.2 aperture"],"Biometrics":"Face ID sensor","Other":["Ambient Light Sensor","Accelerometer","Proximity sensor","Gyroscope","Compass","Barometer"]},{"type":"Audio","Channels":"Stereo","Headphone_Jack":false,"Microphone":true},{"type":"Display","Resolution":{"x":2778,"y":1284},"Screen_Size":"6.7\"","Refresh_Rate":"120 Hz","Peak_Brightness":["1000 nits","1200 nits (HDR)"],"Color_Gamut":"P3","True_Tone":true,"ProMotion":true,"Pixels_per_Inch":510}],"key":"iPhone14,3","imageKey":"iPhone14,3"}