{"name":"Apple TV (1st generation)","identifier":["AppleTV1,1"],"soc":"Pentium M","arch":"x86","type":"Apple TV","board":["Mac-F4228DC8"],"model":["A1218"],"released":["2007-03-21","2007-05-31"],"discontinued":["2009-09-14","2010-09-01"],"colors":[{"name":"Silver","hex":"D9DDE0","released":"2007-03-21","discontinued":"2010-09-01","key":"Silver"}],"key":"AppleTV1,1","imageKey":"AppleTV1,1"}