{"name":"Apple Watch SE 3 (GPS, 44mm)","identifier":["Watch7,14"],"soc":"S10","cpid":"0x8310","arch":"arm64e","type":"Apple Watch","board":["N243bAP"],"bdid":"0x2A","model":["A3325","A3392"],"released":"2025-09-19","colors":[{"name":"Midnight","hex":"161B21","released":"2025-09-19","key":"Midnight"},{"name":"Starlight","hex":"A1948C","released":"2025-09-19","key":"Starlight"}],"key":"Watch7,14","imageKey":"Watch7,14"}