{"name":"iMac (21.5-inch, Late 2013, Dedicated Graphics)","identifier":["iMac14,3"],"imageKey":"iMac14,1","arch":"x86-64","type":"iMac","board":["Mac-77EB7D7DAF985301"],"model":["A1418"],"released":"2013-09-24","discontinued":"2015-10-13","colors":[{"name":"Silver","hex":"E9E9EB","released":"2013-09-24","discontinued":"2015-10-13","key":"Silver"}],"key":"iMac14,3"}